{
  "id": "E-001",
  "kind": "normal",
  "components": [
    "01",
    "09"
  ],
  "input": "学習用の再利用プロンプトを作って。15分、問題は5問。答えを提出するまでは解答を見せない。",
  "expected_behavior": [
    "15分・5問・解答の後出しをMUSTとして保持する",
    "主MDに統合最終版を保存し、元の出題を勝手に実行しない"
  ],
  "failure_conditions": [
    "出題を開始する",
    "問題数や解答タイミングを落とす"
  ],
  "critical": true,
  "requires": [
    "text_model"
  ],
  "origin": "合成：01の学習例と出力境界から設計"
}
